{
  "$schema": "https://lc-json.org/1.0-rc.1/question-set.schema.json",
  "documentType": "questionSet",
  "specVersion": "1.0",
  "title": "Minimal Conforming Question Set",
  "language": "en",
  "questions": [
    {
      "type": "trueFalseQuestion",
      "globalId": "11111111-1111-4111-8111-111111111111",
      "title": "Trivial fact",
      "tags": [],
      "points": 1.0,
      "difficulty": 1.0,
      "prompt": "The Earth orbits the Sun.",
      "correctAnswer": true,
      "displayStyle": "TrueFalse",
      "feedback": {
        "correct": "Yes.",
        "incorrect": "Actually true."
      }
    }
  ]
}
