{
  "$schema": "https://lc-json.org/1.1-rc.1/question-set.schema.json",
  "documentType": "questionSet",
  "specVersion": "1.1",
  "title": "Placement — sectionLabel-mode conformance fixture",
  "language": "en",
  "questions": [
    {
      "type": "placement",
      "globalId": "22222222-2222-4222-8222-222222222203",
      "title": "Section-label placement",
      "points": 2.0,
      "difficulty": 5.0,
      "prompt": "Match each section with the role it plays in the argument.",
      "placementUnit": "sectionLabel",
      "passage": "@@@1 A modest universal basic income would do more to reduce poverty than the means-tested benefits we currently rely on.\n\n@@@2 Critics object that a universal payment would be wasteful and would reduce the incentive to work.",
      "placements": [
        { "gap": 1, "item": "the writer's main claim" },
        { "gap": 2, "item": "the opposing view" }
      ],
      "distractors": ["a personal anecdote"],
      "allowPartialCredit": true,
      "feedback": {
        "correct": "Yes.",
        "incorrect": "Re-read each section."
      }
    }
  ]
}
